{
  "profile_id": "sublime_text",
  "app_name": "Sublime Text",
  "type": "semantic",
  "backend": "shortcut",
  "platform_hint": null,
  "notes": "Auto-generated from ShortcutMapper. 22 shortcuts.",
  "shortcuts": {
    "update_image_size": {
      "keys": "ctrl+u",
      "description": "Update Image Size",
      "keys_macos": "shift+ctrl+i"
    },
    "increment_by_1": {
      "keys": "ctrl+up",
      "description": "Increment by 1"
    },
    "encode_decode_image_to_data_url": {
      "keys": "ctrl+'",
      "description": "Encode/Decode Image to data:URL",
      "keys_macos": "shift+ctrl+d"
    },
    "increment_by_0_1": {
      "keys": "alt+up",
      "description": "Increment by 0.1"
    },
    "go_to_edit_point": {
      "keys": "ctrl+alt+right",
      "description": "Go to Edit Point"
    },
    "split_join_tag": {
      "keys": "shift+ctrl+`",
      "description": "Split/Join Tag",
      "keys_macos": "shift+cmd+'"
    },
    "toggle_comment": {
      "keys": "shift+ctrl+/",
      "description": "Toggle Comment",
      "keys_macos": "shift+alt+/"
    },
    "decrement_by_0_1": {
      "keys": "alt+down",
      "description": "Decrement by 0.1"
    },
    "interactive_expand_abbreviation": {
      "keys": "ctrl+alt+enter",
      "description": "Interactive \u201cExpand Abbreviation\u201d"
    },
    "reflect_css_value": {
      "keys": "shift+ctrl+r",
      "description": "Reflect CSS Value",
      "keys_macos": "shift+cmd+r"
    },
    "wrap_with_abbreviation": {
      "keys": "shift+ctrl+g",
      "description": "Wrap With Abbreviation",
      "keys_macos": "ctrl+w"
    },
    "go_to_matching_pair": {
      "keys": "ctrl+alt+j",
      "description": "Go to Matching Pair",
      "keys_macos": "shift+ctrl+t"
    },
    "remove_tag": {
      "keys": "shift+ctrl+;",
      "description": "Remove Tag",
      "keys_macos": "cmd+'"
    },
    "decrement_by_10": {
      "keys": "shift+alt+down",
      "description": "Decrement by 10",
      "keys_macos": "alt+cmd+down"
    },
    "expand_abbreviation": {
      "keys": "tab",
      "description": "Expand Abbreviation"
    },
    "evaluate_math_expression": {
      "keys": "shift+ctrl+y",
      "description": "Evaluate Math Expression",
      "keys_macos": "shift+cmd+y"
    },
    "match_tag_pair_inward": {
      "keys": "shift+ctrl+0",
      "description": "Match Tag Pair Inward",
      "keys_macos": "ctrl+j"
    },
    "increment_by_10": {
      "keys": "shift+alt+up",
      "description": "Increment by 10",
      "keys_macos": "alt+cmd+up"
    },
    "decrement_by_1": {
      "keys": "ctrl+down",
      "description": "Decrement by 1"
    },
    "select_item": {
      "keys": "shift+ctrl+.",
      "description": "Select Item",
      "keys_macos": "shift+cmd+."
    },
    "rename_tag": {
      "keys": "shift+ctrl+'",
      "description": "Rename Tag",
      "keys_macos": "shift+cmd+k"
    },
    "match_tag_pair_outward": {
      "keys": "ctrl+,",
      "description": "Match Tag Pair Outward",
      "keys_macos": "ctrl+d"
    }
  },
  "semantic_elements": {
    "update_image_size": {
      "label": "Update Image Size",
      "aliases": [
        "update image size"
      ],
      "action": "shortcut",
      "shortcut": {
        "keys": "ctrl+u",
        "description": "Update Image Size",
        "keys_macos": "shift+ctrl+i"
      }
    },
    "increment_by_1": {
      "label": "Increment by 1",
      "aliases": [
        "increment by 1"
      ],
      "action": "shortcut",
      "shortcut": {
        "keys": "ctrl+up",
        "description": "Increment by 1"
      }
    },
    "encode_decode_image_to_data_url": {
      "label": "Encode/Decode Image to data:URL",
      "aliases": [
        "encode/decode image to data:url",
        "encode",
        "decode image to data:url"
      ],
      "action": "shortcut",
      "shortcut": {
        "keys": "ctrl+'",
        "description": "Encode/Decode Image to data:URL",
        "keys_macos": "shift+ctrl+d"
      }
    },
    "increment_by_0_1": {
      "label": "Increment by 0.1",
      "aliases": [
        "increment by 0.1"
      ],
      "action": "shortcut",
      "shortcut": {
        "keys": "alt+up",
        "description": "Increment by 0.1"
      }
    },
    "go_to_edit_point": {
      "label": "Go to Edit Point",
      "aliases": [
        "go to edit point"
      ],
      "action": "shortcut",
      "shortcut": {
        "keys": "ctrl+alt+right",
        "description": "Go to Edit Point"
      }
    },
    "split_join_tag": {
      "label": "Split/Join Tag",
      "aliases": [
        "split/join tag",
        "split",
        "join tag"
      ],
      "action": "shortcut",
      "shortcut": {
        "keys": "shift+ctrl+`",
        "description": "Split/Join Tag",
        "keys_macos": "shift+cmd+'"
      }
    },
    "toggle_comment": {
      "label": "Toggle Comment",
      "aliases": [
        "toggle comment"
      ],
      "action": "shortcut",
      "shortcut": {
        "keys": "shift+ctrl+/",
        "description": "Toggle Comment",
        "keys_macos": "shift+alt+/"
      }
    },
    "decrement_by_0_1": {
      "label": "Decrement by 0.1",
      "aliases": [
        "decrement by 0.1"
      ],
      "action": "shortcut",
      "shortcut": {
        "keys": "alt+down",
        "description": "Decrement by 0.1"
      }
    },
    "interactive_expand_abbreviation": {
      "label": "Interactive \u201cExpand Abbreviation\u201d",
      "aliases": [
        "interactive \u201cexpand abbreviation\u201d"
      ],
      "action": "shortcut",
      "shortcut": {
        "keys": "ctrl+alt+enter",
        "description": "Interactive \u201cExpand Abbreviation\u201d"
      }
    },
    "reflect_css_value": {
      "label": "Reflect CSS Value",
      "aliases": [
        "reflect css value"
      ],
      "action": "shortcut",
      "shortcut": {
        "keys": "shift+ctrl+r",
        "description": "Reflect CSS Value",
        "keys_macos": "shift+cmd+r"
      }
    },
    "wrap_with_abbreviation": {
      "label": "Wrap With Abbreviation",
      "aliases": [
        "wrap with abbreviation"
      ],
      "action": "shortcut",
      "shortcut": {
        "keys": "shift+ctrl+g",
        "description": "Wrap With Abbreviation",
        "keys_macos": "ctrl+w"
      }
    },
    "go_to_matching_pair": {
      "label": "Go to Matching Pair",
      "aliases": [
        "go to matching pair"
      ],
      "action": "shortcut",
      "shortcut": {
        "keys": "ctrl+alt+j",
        "description": "Go to Matching Pair",
        "keys_macos": "shift+ctrl+t"
      }
    },
    "remove_tag": {
      "label": "Remove Tag",
      "aliases": [
        "remove tag"
      ],
      "action": "shortcut",
      "shortcut": {
        "keys": "shift+ctrl+;",
        "description": "Remove Tag",
        "keys_macos": "cmd+'"
      }
    },
    "decrement_by_10": {
      "label": "Decrement by 10",
      "aliases": [
        "decrement by 10"
      ],
      "action": "shortcut",
      "shortcut": {
        "keys": "shift+alt+down",
        "description": "Decrement by 10",
        "keys_macos": "alt+cmd+down"
      }
    },
    "expand_abbreviation": {
      "label": "Expand Abbreviation",
      "aliases": [
        "expand abbreviation"
      ],
      "action": "shortcut",
      "shortcut": {
        "keys": "tab",
        "description": "Expand Abbreviation"
      }
    },
    "evaluate_math_expression": {
      "label": "Evaluate Math Expression",
      "aliases": [
        "evaluate math expression"
      ],
      "action": "shortcut",
      "shortcut": {
        "keys": "shift+ctrl+y",
        "description": "Evaluate Math Expression",
        "keys_macos": "shift+cmd+y"
      }
    },
    "match_tag_pair_inward": {
      "label": "Match Tag Pair Inward",
      "aliases": [
        "match tag pair inward"
      ],
      "action": "shortcut",
      "shortcut": {
        "keys": "shift+ctrl+0",
        "description": "Match Tag Pair Inward",
        "keys_macos": "ctrl+j"
      }
    },
    "increment_by_10": {
      "label": "Increment by 10",
      "aliases": [
        "increment by 10"
      ],
      "action": "shortcut",
      "shortcut": {
        "keys": "shift+alt+up",
        "description": "Increment by 10",
        "keys_macos": "alt+cmd+up"
      }
    },
    "decrement_by_1": {
      "label": "Decrement by 1",
      "aliases": [
        "decrement by 1"
      ],
      "action": "shortcut",
      "shortcut": {
        "keys": "ctrl+down",
        "description": "Decrement by 1"
      }
    },
    "select_item": {
      "label": "Select Item",
      "aliases": [
        "select item"
      ],
      "action": "shortcut",
      "shortcut": {
        "keys": "shift+ctrl+.",
        "description": "Select Item",
        "keys_macos": "shift+cmd+."
      }
    },
    "rename_tag": {
      "label": "Rename Tag",
      "aliases": [
        "rename tag"
      ],
      "action": "shortcut",
      "shortcut": {
        "keys": "shift+ctrl+'",
        "description": "Rename Tag",
        "keys_macos": "shift+cmd+k"
      }
    },
    "match_tag_pair_outward": {
      "label": "Match Tag Pair Outward",
      "aliases": [
        "match tag pair outward"
      ],
      "action": "shortcut",
      "shortcut": {
        "keys": "ctrl+,",
        "description": "Match Tag Pair Outward",
        "keys_macos": "ctrl+d"
      }
    }
  }
}